resultado,titulo,imagem,texto
0,YOU ARE GA... CAMBISTA!!,imagem_youre_cambista.png,"Você <span class=""negrito"">errou todas</span> as perguntas! Eu tomaria cuidado ao andar perto do Allianz nos dias de shows. As swifters podem te pegar!"
1,YOU ARE GA... CAMBISTA!!,imagem_youre_cambista.png,"Você acertou <span class=""negrito"">apenas uma</span> pergunta! Ou chutou... Eu tomaria cuidado ao andar perto do Allianz nos dias de shows. As swifters podem te pegar!"
2,VOCÊ É PARENTE DE SWIFTER! ,imagem_parente_swifter.png,"Você acertou <span class=""negrito"">duas</span> perguntas! Você, com certeza, é mãe, pai, namorade, amige de alguma pessoa que gosta muito de Taylor Swift! Eu sinto muito!"
3,VOCÊ É UMA NOVA SWIFTER!,imagem_nova_swifter.png,"Você acertou <span class=""negrito"">três</span>! Pela quantidade, você deve ser nova no fandom. Eu te desejo boa sorte!"
4,ATENÇÃO SWIFTER DE CARTEIRINHA AQUI,imagem_swifter_carteirinha.png,"Você acertou <span class=""negrito"">quatro</span>! Você é realmente uma swifter! Toma a sua carteirinha!"
5,VOCÊ É A PRÓPRIA TAYLOR SWIFT!! ,imagem_propria_taylor.png,"Você acertou <span class=""negrito"">todas</span> as perguntas! Você é praticamente a Taylor ou uma mastermind"